{
  "$schema": "https://json-schema.org/draft/2020-12/schema",
  "$id": "https://github.com/estebanmoreno04/vgc-coach-esteban/data/schemas/regulation-v1.schema.json",
  "title": "Active regulation (regulation-v1)",
  "description": "Written by tools/resolve_regulation.py to data/current/regulation.json.",
  "type": "object",
  "required": [
    "schema_version",
    "regulation_id",
    "game",
    "active_window",
    "mechanics",
    "official_url",
    "detected_at",
    "checked_at",
    "confidence",
    "stale",
    "agreeing_sources",
    "next_regulation",
    "sources",
    "warnings"
  ],
  "properties": {
    "schema_version": { "const": "regulation-v1" },
    "regulation_id": { "type": "string", "pattern": "^[A-Z](-[A-Z0-9])?$" },
    "label": { "type": "string" },
    "game": { "type": "string", "pattern": "^[a-z0-9-]+$" },
    "active_window": {
      "oneOf": [{ "type": "null" }, { "$ref": "#/$defs/window" }]
    },
    "mechanics": {
      "type": "array",
      "items": { "type": "string", "pattern": "^[a-z0-9-]+$" },
      "uniqueItems": true
    },
    "rules": {
      "type": "object",
      "properties": {
        "held_items": {
          "type": "object",
          "properties": { "duplicates_allowed": { "type": "boolean" } }
        },
        "timers_seconds": {
          "type": "object",
          "additionalProperties": { "type": "integer", "minimum": 0 }
        }
      }
    },
    "official_url": { "type": ["string", "null"], "format": "uri" },
    "detected_at": { "$ref": "#/$defs/timestamp" },
    "checked_at": { "$ref": "#/$defs/timestamp" },
    "archived_at": { "$ref": "#/$defs/timestamp" },
    "confidence": { "enum": ["high", "medium", "low"] },
    "stale": { "type": "boolean" },
    "agreeing_sources": { "type": "array", "items": { "type": "string" } },
    "previous_regulation_id": { "type": ["string", "null"] },
    "next_regulation": {
      "oneOf": [
        { "type": "null" },
        {
          "type": "object",
          "required": ["regulation_id", "expected_window", "sources"],
          "properties": {
            "regulation_id": { "type": "string", "pattern": "^[A-Z](-[A-Z0-9])?$" },
            "expected_window": {
              "oneOf": [{ "type": "null" }, { "$ref": "#/$defs/window" }]
            },
            "official_url": { "type": ["string", "null"] },
            "sources": { "type": "array", "items": { "type": "string" }, "minItems": 1 }
          }
        }
      ]
    },
    "sources": {
      "type": "array",
      "items": {
        "type": "object",
        "required": ["source_id", "kind", "url", "status"],
        "properties": {
          "source_id": { "type": "string" },
          "display_name": { "type": "string" },
          "kind": { "enum": ["official", "community", "supporting", "editorial"] },
          "url": { "type": "string" },
          "status": { "enum": ["ok", "error", "blocked"] },
          "error": { "type": ["string", "null"] },
          "fetched_at": {
            "oneOf": [{ "type": "null" }, { "$ref": "#/$defs/timestamp" }]
          },
          "current_vote": { "type": ["string", "null"] },
          "upcoming": { "type": "array", "items": { "type": "string" } },
          "notes": { "type": "array", "items": { "type": "string" } }
        }
      }
    },
    "warnings": { "type": "array", "items": { "type": "string" } }
  },
  "$defs": {
    "timestamp": {
      "type": "string",
      "pattern": "^\\d{4}-\\d{2}-\\d{2}T\\d{2}:\\d{2}:\\d{2}Z$"
    },
    "window": {
      "type": "object",
      "required": ["start", "end", "precision", "source_id"],
      "properties": {
        "start": { "$ref": "#/$defs/timestamp" },
        "end": {
          "oneOf": [{ "type": "null" }, { "$ref": "#/$defs/timestamp" }]
        },
        "precision": { "enum": ["minute", "day", "month"] },
        "source_id": { "type": "string" }
      }
    }
  }
}
